{
    "type": "object",
    "$schema": "http://json-schema.org/draft-07/schema#",
    "required": [
        "code"
    ],
    "x-unique": [
        "code"
    ],
    "properties": {
        "code": {
            "type": "string"
        },
        "name": {
            "type": "string"
        },
        "active": {
            "type": "boolean"
        },
        "description": {
            "type": "string"
        }
    }
}